{"actor_id":"fixture-m0-bootstrap-derivation-recorder","completed_at":"2026-06-01T12:03:24Z","fsync_result":"FILE_AND_PARENT_DIRECTORY_DURABLE","issued_at":"2026-06-01T12:03:24Z","issuer_id":"fixture-m0-terminal-receipt-issuer","operation":"CREATE_IF_ABSENT","output_ref":"contracts/fixtures/governance-models/valid/m0-planning-bootstrap-post-reconciliation-candidate-derivation.json","output_sha256":"fdd020520bb7a523328bf6809a1667665926dd1ba6c8d35677943f4fb24bb977","permission_ref":"contracts/fixtures/governance-models/valid/m0-operation-authority-phase-b-derivation-record-write-repository-write.json","permission_sha256":"27d81aa9fbd94a97fdb79d65d7842d772b622ccc6f66b2da6167f59177b9cf19","receipt_id":"fixture-m0-post-reconciliation-candidate-derivation-operation-receipt","repository_locator":"fixture://m0-bootstrap/repository","result":"CREATED_EXACT","schema":"ylx.repository-operation-receipt.v1","signature":"3PeYD8tXdrHcdlFKEnKtiI0fPv2+J8g9aSdiUoQMimMtO0OzgEjIGisZjYBtokTY+BjolUwK5Z4QWhIoqR2VDA==","signature_algorithm":"Ed25519","signed_payload_sha256":"d34189ba90544755f9f58c3fa7b83705442a978653f33858a6e25ab7b32ad32a","signing_key_id":"fixture-m0-terminal-receipt-issuer-key","sink_id":"fixture-m0-terminal-audit-sink","started_at":"2026-06-01T12:03:23Z","target_scope":"contracts/fixtures/governance-models/valid/m0-planning-bootstrap-post-reconciliation-candidate-derivation.json"}