{"actor_id":"fixture-m0-issue-register-publisher","completed_at":"2026-06-01T12:03:16Z","fsync_result":"FILE_AND_PARENT_DIRECTORY_DURABLE","issued_at":"2026-06-01T12:03:16Z","issuer_id":"fixture-m0-terminal-receipt-issuer","operation":"CREATE_IMMUTABLE_ARCHIVE","output_ref":"contracts/fixtures/governance-models/support/m0-g0-issue-register-replacement-archive.md","output_sha256":"5f282ded72c72eee9cb00a4611f42c775a76c830cb7325ba6e253ab95915b97a","permission_ref":"contracts/fixtures/governance-models/valid/m0-operation-authority-issue-archive-write-repository-write.json","permission_sha256":"0843fa757324e24643df44fc93006f7c4bdcebe42abd452291504dea6e4d4274","receipt_id":"fixture-m0-g0-issue-archive-operation-receipt","repository_locator":"fixture://m0-bootstrap/repository","result":"CREATED_EXACT","schema":"ylx.repository-operation-receipt.v1","signature":"/GXXx7YNM9wR0x0uM15ngQJ1SjxGk5bXZrufjxa6wqpjkBo2kKVDERE9H0bg22sM3TocRfCleM3W1h/oODyNDg==","signature_algorithm":"Ed25519","signed_payload_sha256":"3af5ade4c335e8798beaef803444a4e9c03162f4373252f0be0bd8babda18ae9","signing_key_id":"fixture-m0-terminal-receipt-issuer-key","sink_id":"fixture-m0-terminal-audit-sink","started_at":"2026-06-01T12:03:15Z","target_scope":"contracts/fixtures/governance-models/support/m0-g0-issue-register-replacement-archive.md"}